Topic,Subtopic,Question,Eval Function,Resulting Lesson
Counting,Count to 10,How many balloons are there in total (popped and unpopped)?,4,This is how you count balloons: u (1) O (2) u (3)... and keep going!
Counting,Count to 10,Number popped?,3,Count how many times u shows up. Pop goes the balllloooon...!
Counting,Count to 10,Number unpopped?,1,Count how many times O shows up
Structure of a fraction,,Which number goes on top of the fraction?,3,The top number is how many of the things are what you are looking for
Structure of a fraction,,Which number goes on the bottom of the fraction?,4,The bottom number is how many things total there are